[
  {
    "id": 0,
    "key": "slime",
    "name": "Slime",
    "strength": 5,
    "agility": 3,
    "hp_min": 3,
    "hp_max": 3,
    "xp": 1,
    "gp_min": 1,
    "gp_max": 1,
    "resist_sleep": 0,
    "resist_stopspell": 15,
    "resist_hurt": 0,
    "dodge": 1,
    "pattern": [
      {
        "action": "attack",
        "chance": "always"
      }
    ],
    "run_group": 1
  },
  {
    "id": 1,
    "key": "red_slime",
    "name": "Red Slime",
    "strength": 7,
    "agility": 3,
    "hp_min": 4,
    "hp_max": 4,
    "xp": 1,
    "gp_min": 2,
    "gp_max": 2,
    "resist_sleep": 0,
    "resist_stopspell": 15,
    "resist_hurt": 0,
    "dodge": 1,
    "pattern": [
      {
        "action": "attack",
        "chance": "always"
      }
    ],
    "run_group": 1
  },
  {
    "id": 2,
    "key": "drakee",
    "name": "Drakee",
    "strength": 9,
    "agility": 6,
    "hp_min": 5,
    "hp_max": 6,
    "xp": 2,
    "gp_min": 2,
    "gp_max": 2,
    "resist_sleep": 0,
    "resist_stopspell": 15,
    "resist_hurt": 0,
    "dodge": 1,
    "pattern": [
      {
        "action": "attack",
        "chance": "always"
      }
    ],
    "run_group": 1
  },
  {
    "id": 3,
    "key": "ghost",
    "name": "Ghost",
    "strength": 11,
    "agility": 8,
    "hp_min": 6,
    "hp_max": 7,
    "xp": 3,
    "gp_min": 3,
    "gp_max": 4,
    "resist_sleep": 0,
    "resist_stopspell": 15,
    "resist_hurt": 0,
    "dodge": 4,
    "pattern": [
      {
        "action": "attack",
        "chance": "always"
      }
    ],
    "run_group": 1
  },
  {
    "id": 4,
    "key": "magician",
    "name": "Magician",
    "strength": 11,
    "agility": 12,
    "hp_min": 10,
    "hp_max": 13,
    "xp": 4,
    "gp_min": 9,
    "gp_max": 11,
    "resist_sleep": 0,
    "resist_stopspell": 0,
    "resist_hurt": 0,
    "dodge": 1,
    "pattern": [
      {
        "action": "spell_hurt",
        "chance": 0.5
      },
      {
        "action": "attack",
        "chance": "otherwise"
      }
    ],
    "run_group": 1
  },
  {
    "id": 5,
    "key": "magidrakee",
    "name": "Magidrakee",
    "strength": 14,
    "agility": 14,
    "hp_min": 12,
    "hp_max": 15,
    "xp": 5,
    "gp_min": 9,
    "gp_max": 11,
    "resist_sleep": 0,
    "resist_stopspell": 0,
    "resist_hurt": 0,
    "dodge": 1,
    "pattern": [
      {
        "action": "spell_hurt",
        "chance": 0.5
      },
      {
        "action": "attack",
        "chance": "otherwise"
      }
    ],
    "run_group": 1
  },
  {
    "id": 6,
    "key": "scorpion",
    "name": "Scorpion",
    "strength": 18,
    "agility": 16,
    "hp_min": 16,
    "hp_max": 20,
    "xp": 6,
    "gp_min": 12,
    "gp_max": 15,
    "resist_sleep": 0,
    "resist_stopspell": 15,
    "resist_hurt": 0,
    "dodge": 1,
    "pattern": [
      {
        "action": "attack",
        "chance": "always"
      }
    ],
    "run_group": 1
  },
  {
    "id": 7,
    "key": "druin",
    "name": "Druin",
    "strength": 20,
    "agility": 18,
    "hp_min": 17,
    "hp_max": 22,
    "xp": 7,
    "gp_min": 12,
    "gp_max": 15,
    "resist_sleep": 0,
    "resist_stopspell": 15,
    "resist_hurt": 0,
    "dodge": 2,
    "pattern": [
      {
        "action": "attack",
        "chance": "always"
      }
    ],
    "run_group": 1
  },
  {
    "id": 8,
    "key": "poltergeist",
    "name": "Poltergeist",
    "strength": 18,
    "agility": 20,
    "hp_min": 18,
    "hp_max": 23,
    "xp": 8,
    "gp_min": 13,
    "gp_max": 17,
    "resist_sleep": 0,
    "resist_stopspell": 0,
    "resist_hurt": 0,
    "dodge": 6,
    "pattern": [
      {
        "action": "spell_hurt",
        "chance": 0.75
      },
      {
        "action": "attack",
        "chance": "otherwise"
      }
    ],
    "run_group": 1
  },
  {
    "id": 9,
    "key": "droll",
    "name": "Droll",
    "strength": 24,
    "agility": 24,
    "hp_min": 19,
    "hp_max": 25,
    "xp": 10,
    "gp_min": 18,
    "gp_max": 24,
    "resist_sleep": 0,
    "resist_stopspell": 14,
    "resist_hurt": 0,
    "dodge": 2,
    "pattern": [
      {
        "action": "attack",
        "chance": "always"
      }
    ],
    "run_group": 1
  },
  {
    "id": 10,
    "key": "drakeema",
    "name": "Drakeema",
    "strength": 22,
    "agility": 26,
    "hp_min": 16,
    "hp_max": 20,
    "xp": 11,
    "gp_min": 15,
    "gp_max": 19,
    "resist_sleep": 2,
    "resist_stopspell": 0,
    "resist_hurt": 0,
    "dodge": 6,
    "pattern": [
      {
        "action": "spell_heal",
        "chance": 0.25,
        "condition": "hp_below_quarter"
      },
      {
        "action": "spell_hurt",
        "chance": 0.5
      },
      {
        "action": "attack",
        "chance": "otherwise"
      }
    ],
    "run_group": 1
  },
  {
    "id": 11,
    "key": "skeleton",
    "name": "Skeleton",
    "strength": 28,
    "agility": 22,
    "hp_min": 23,
    "hp_max": 30,
    "xp": 11,
    "gp_min": 22,
    "gp_max": 29,
    "resist_sleep": 0,
    "resist_stopspell": 15,
    "resist_hurt": 0,
    "dodge": 4,
    "pattern": [
      {
        "action": "attack",
        "chance": "always"
      }
    ],
    "run_group": 1
  },
  {
    "id": 12,
    "key": "warlock",
    "name": "Warlock",
    "strength": 28,
    "agility": 22,
    "hp_min": 23,
    "hp_max": 30,
    "xp": 13,
    "gp_min": 26,
    "gp_max": 34,
    "resist_sleep": 3,
    "resist_stopspell": 1,
    "resist_hurt": 0,
    "dodge": 2,
    "pattern": [
      {
        "action": "spell_sleep",
        "chance": 0.25,
        "condition": "hero_not_asleep"
      },
      {
        "action": "spell_hurt",
        "chance": 0.5
      },
      {
        "action": "attack",
        "chance": "otherwise"
      }
    ],
    "run_group": 1
  },
  {
    "id": 13,
    "key": "metal_scorpion",
    "name": "Metal Scorpion",
    "strength": 36,
    "agility": 42,
    "hp_min": 17,
    "hp_max": 22,
    "xp": 14,
    "gp_min": 30,
    "gp_max": 39,
    "resist_sleep": 0,
    "resist_stopspell": 15,
    "resist_hurt": 0,
    "dodge": 2,
    "pattern": [
      {
        "action": "attack",
        "chance": "always"
      }
    ],
    "run_group": 1
  },
  {
    "id": 14,
    "key": "wolf",
    "name": "Wolf",
    "strength": 40,
    "agility": 30,
    "hp_min": 26,
    "hp_max": 34,
    "xp": 16,
    "gp_min": 37,
    "gp_max": 49,
    "resist_sleep": 1,
    "resist_stopspell": 15,
    "resist_hurt": 0,
    "dodge": 2,
    "pattern": [
      {
        "action": "attack",
        "chance": "always"
      }
    ],
    "run_group": 1
  },
  {
    "id": 15,
    "key": "wraith",
    "name": "Wraith",
    "strength": 44,
    "agility": 34,
    "hp_min": 28,
    "hp_max": 36,
    "xp": 17,
    "gp_min": 45,
    "gp_max": 59,
    "resist_sleep": 7,
    "resist_stopspell": 0,
    "resist_hurt": 0,
    "dodge": 4,
    "pattern": [
      {
        "action": "spell_heal",
        "chance": 0.25,
        "condition": "hp_below_quarter"
      },
      {
        "action": "attack",
        "chance": "otherwise"
      }
    ],
    "run_group": 1
  },
  {
    "id": 16,
    "key": "metal_slime",
    "name": "Metal Slime",
    "strength": 10,
    "agility": 255,
    "hp_min": 4,
    "hp_max": 4,
    "xp": 115,
    "gp_min": 4,
    "gp_max": 5,
    "resist_sleep": 15,
    "resist_stopspell": 15,
    "resist_hurt": 15,
    "dodge": 1,
    "pattern": [
      {
        "action": "spell_hurt",
        "chance": 0.75
      },
      {
        "action": "attack",
        "chance": "otherwise"
      }
    ],
    "run_group": 1
  },
  {
    "id": 17,
    "key": "specter",
    "name": "Specter",
    "strength": 40,
    "agility": 38,
    "hp_min": 28,
    "hp_max": 36,
    "xp": 18,
    "gp_min": 52,
    "gp_max": 69,
    "resist_sleep": 3,
    "resist_stopspell": 1,
    "resist_hurt": 0,
    "dodge": 4,
    "pattern": [
      {
        "action": "spell_sleep",
        "chance": 0.25,
        "condition": "hero_not_asleep"
      },
      {
        "action": "spell_hurt",
        "chance": 0.75
      },
      {
        "action": "attack",
        "chance": "otherwise"
      }
    ],
    "run_group": 1
  },
  {
    "id": 18,
    "key": "wolflord",
    "name": "Wolflord",
    "strength": 50,
    "agility": 36,
    "hp_min": 29,
    "hp_max": 38,
    "xp": 20,
    "gp_min": 60,
    "gp_max": 79,
    "resist_sleep": 4,
    "resist_stopspell": 7,
    "resist_hurt": 0,
    "dodge": 2,
    "pattern": [
      {
        "action": "spell_stopspell",
        "chance": 0.5,
        "condition": "hero_spell_not_blocked"
      },
      {
        "action": "attack",
        "chance": "otherwise"
      }
    ],
    "run_group": 1
  },
  {
    "id": 19,
    "key": "druinlord",
    "name": "Druinlord",
    "strength": 47,
    "agility": 40,
    "hp_min": 27,
    "hp_max": 35,
    "xp": 20,
    "gp_min": 63,
    "gp_max": 84,
    "resist_sleep": 15,
    "resist_stopspell": 0,
    "resist_hurt": 0,
    "dodge": 4,
    "pattern": [
      {
        "action": "spell_heal",
        "chance": 0.75,
        "condition": "hp_below_quarter"
      },
      {
        "action": "spell_hurt",
        "chance": 0.25
      },
      {
        "action": "attack",
        "chance": "otherwise"
      }
    ],
    "run_group": 1
  },
  {
    "id": 20,
    "key": "drollmagi",
    "name": "Drollmagi",
    "strength": 52,
    "agility": 50,
    "hp_min": 29,
    "hp_max": 38,
    "xp": 22,
    "gp_min": 67,
    "gp_max": 89,
    "resist_sleep": 2,
    "resist_stopspell": 2,
    "resist_hurt": 0,
    "dodge": 1,
    "pattern": [
      {
        "action": "spell_stopspell",
        "chance": 0.5,
        "condition": "hero_spell_not_blocked"
      },
      {
        "action": "attack",
        "chance": "otherwise"
      }
    ],
    "run_group": 2
  },
  {
    "id": 21,
    "key": "wyvern",
    "name": "Wyvern",
    "strength": 56,
    "agility": 48,
    "hp_min": 32,
    "hp_max": 42,
    "xp": 24,
    "gp_min": 75,
    "gp_max": 99,
    "resist_sleep": 4,
    "resist_stopspell": 15,
    "resist_hurt": 0,
    "dodge": 2,